{
  "statementID": "487e303b-f5be-4dc2-bcae-b0803546fa29",
  "statementType": "ownershipOrControlStatement",
  "isComponent": false,
  "subject": {
    "describedByEntityStatement": "3ff64336-9d26-49da-b0ce-f4685c6af139"
  },
  "interestedParty": {
    "describedByPersonStatement": "5eb1e15c-fd25-40c7-8a75-246c79654185"
  },
  "interests": [
    {
      "type": "shareholding",
      "interestLevel": "direct",
      "share": {
        "minimum": 25,
        "maximum": 50
      },
      "startDate": "2016-07-07"
    },
    {
      "type": "voting-rights",
      "interestLevel": "direct",
      "share": {
        "minimum": 25,
        "maximum": 50
      },
      "startDate": "2016-07-07"
    }
  ],
  "publicationDetails": {
    "publicationDate": "2017-12-01",
    "bodsVersion": "0.2",
    "publisher": {
      "name": "XXXXXXXXX"
    }
  }
}
